{"$schema":"https://json-schema.org/draft/2020-12/schema","$id":"policy_pack.schema.json","x-schema-version":"1.0","type":"object","required":["$schema","schema_version","id","vertical","defaults","overrides"],"properties":{"$schema":{"type":"string","minLength":1},"schema_version":{"type":"string","minLength":1},"id":{"type":"string","minLength":1},"vertical":{"type":"string","minLength":1},"defaults":{"type":"object","required":["max_goal_token_budget","pilot_repos"],"properties":{"max_goal_token_budget":{"type":"number","minimum":1},"pilot_repos":{"type":"array","minItems":1,"items":{"type":"object","required":["id","blast_radius"],"properties":{"id":{"type":"string","minLength":1},"blast_radius":{"type":"string","enum":["LOW","MEDIUM","HIGH"]}},"additionalProperties":false}}},"additionalProperties":false},"overrides":{"type":"array","items":{"type":"object","required":["field","value","justification","approved_by"],"properties":{"field":{"type":"string","enum":["max_goal_token_budget"]},"value":{"type":"number","minimum":1},"justification":{"type":"string","minLength":1},"approved_by":{"type":"string","minLength":1}},"additionalProperties":false}}},"additionalProperties":false}
